T:  Bus=01 Lev=00 Prnt=00 Port=00 Cnt=00 Dev#=  1 Spd=480 MxCh=14
D:  Ver= 2.00 Cls=09(hub  ) Sub=00 Prot=01 MxPS=64 #Cfgs=  1
P:  Vendor=1d6b ProdID=0002 Rev=04.07
S:  Manufacturer=Linux 4.7.4-1-ARCH xhci-hcd
S:  Product=xHCI Host Controller
S:  SerialNumber=0000:00:14.0
C:  #Ifs= 1 Cfg#= 1 Atr=e0 MxPwr=0mA
I:  If#= 0 Alt= 0 #EPs= 1 Cls=09(hub  ) Sub=00 Prot=00 Driver=hub

T:  Bus=01 Lev=01 Prnt=01 Port=01 Cnt=01 Dev#=  2 Spd=1.5 MxCh= 0
D:  Ver= 1.10 Cls=00(>ifc ) Sub=00 Prot=00 MxPS= 8 #Cfgs=  1
P:  Vendor=04d9 ProdID=1702 Rev=04.06
S:  Manufacturer= 
S:  Product=USB Keyboard
C:  #Ifs= 2 Cfg#= 1 Atr=a0 MxPwr=100mA
I:  If#= 0 Alt= 0 #EPs= 1 Cls=03(HID  ) Sub=01 Prot=01 Driver=usbhid
I:  If#= 1 Alt= 0 #EPs= 1 Cls=03(HID  ) Sub=00 Prot=00 Driver=usbhid

T:  Bus=01 Lev=01 Prnt=01 Port=03 Cnt=02 Dev#=  3 Spd=1.5 MxCh= 0
D:  Ver= 1.10 Cls=00(>ifc ) Sub=00 Prot=00 MxPS= 8 #Cfgs=  1
P:  Vendor=093a ProdID=2521 Rev=01.00
S:  Product=USB OPTICAL MOUSE
C:  #Ifs= 1 Cfg#= 1 Atr=a0 MxPwr=100mA
I:  If#= 0 Alt= 0 #EPs= 1 Cls=03(HID  ) Sub=01 Prot=02 Driver=usbhid

T:  Bus=01 Lev=01 Prnt=01 Port=06 Cnt=03 Dev#=  5 Spd=480 MxCh= 0
D:  Ver= 2.00 Cls=ef(misc ) Sub=02 Prot=01 MxPS=64 #Cfgs=  1
P:  Vendor=1bcf ProdID=2883 Rev=04.29
S:  Manufacturer=04G626000611BQ3BC0013BV
S:  Product=ASUS USB2.0 Webcam
C:  #Ifs= 2 Cfg#= 1 Atr=80 MxPwr=500mA
I:  If#= 0 Alt= 0 #EPs= 1 Cls=0e(video) Sub=01 Prot=00 Driver=uvcvideo
I:  If#= 1 Alt= 0 #EPs= 0 Cls=0e(video) Sub=02 Prot=00 Driver=uvcvideo

T:  Bus=02 Lev=00 Prnt=00 Port=00 Cnt=00 Dev#=  1 Spd=5000 MxCh= 4
D:  Ver= 3.00 Cls=09(hub  ) Sub=00 Prot=03 MxPS= 9 #Cfgs=  1
P:  Vendor=1d6b ProdID=0003 Rev=04.07
S:  Manufacturer=Linux 4.7.4-1-ARCH xhci-hcd
S:  Product=xHCI Host Controller
S:  SerialNumber=0000:00:14.0
C:  #Ifs= 1 Cfg#= 1 Atr=e0 MxPwr=0mA
I:  If#= 0 Alt= 0 #EPs= 1 Cls=09(hub  ) Sub=00 Prot=00 Driver=hub
